{
  "$schema": "https://json-schema.org/draft/2020-12/schema",
  "$id": "https://yujian.me/schemas/content-snapshot/1.0.0",
  "title": "Yujian content snapshot",
  "type": "object",
  "additionalProperties": false,
  "required": [
    "schemaVersion",
    "releaseId",
    "generatedAt",
    "site",
    "homepage",
    "heroSlides",
    "releases",
    "tracks",
    "videos",
    "events",
    "moments",
    "artist",
    "assets"
  ],
  "properties": {
    "schemaVersion": {
      "const": "1.0.0"
    },
    "releaseId": {
      "type": "string",
      "pattern": "^rel_[0-9a-f]{8}-[0-9a-f]{4}-4[0-9a-f]{3}-[89ab][0-9a-f]{3}-[0-9a-f]{12}$"
    },
    "generatedAt": {
      "type": "string",
      "format": "date-time"
    },
    "site": {
      "$ref": "#/$defs/SiteConfig"
    },
    "homepage": {
      "$ref": "#/$defs/Homepage"
    },
    "heroSlides": {
      "type": "array",
      "items": {
        "$ref": "#/$defs/HeroSlide"
      }
    },
    "releases": {
      "type": "array",
      "items": {
        "$ref": "#/$defs/Release"
      }
    },
    "tracks": {
      "type": "array",
      "items": {
        "$ref": "#/$defs/Track"
      }
    },
    "videos": {
      "type": "array",
      "items": {
        "$ref": "#/$defs/Video"
      }
    },
    "events": {
      "type": "array",
      "items": {
        "$ref": "#/$defs/Event"
      }
    },
    "moments": {
      "type": "array",
      "items": {
        "$ref": "#/$defs/Moment"
      }
    },
    "artist": {
      "$ref": "#/$defs/ArtistProfile"
    },
    "assets": {
      "type": "array",
      "items": {
        "$ref": "#/$defs/Asset"
      }
    }
  },
  "$defs": {
    "LocalizedText": {
      "type": "object",
      "additionalProperties": false,
      "required": ["zh-CN"],
      "properties": {
        "zh-CN": {
          "type": "string",
          "minLength": 1
        },
        "en": {
          "type": "string",
          "minLength": 1
        }
      }
    },
    "HttpsUrl": {
      "type": "string",
      "format": "https-url",
      "pattern": "^https://[^/?#\\\\ \\t\\r\\n]+([/?#]|$)"
    },
    "MediaUrl": {
      "oneOf": [
        {
          "type": "string",
          "pattern": "^/media/"
        },
        {
          "$ref": "#/$defs/HttpsUrl"
        }
      ]
    },
    "PlatformLink": {
      "type": "object",
      "additionalProperties": false,
      "required": ["provider", "url"],
      "properties": {
        "provider": {
          "enum": [
            "qq-music",
            "netease-music",
            "weibo",
            "bilibili",
            "douyin",
            "website",
            "other"
          ]
        },
        "url": {
          "$ref": "#/$defs/HttpsUrl"
        },
        "label": {
          "$ref": "#/$defs/LocalizedText"
        }
      }
    },
    "ContentTarget": {
      "oneOf": [
        {
          "type": "object",
          "additionalProperties": false,
          "required": ["kind", "contentId"],
          "properties": {
            "kind": {
              "const": "internal"
            },
            "contentId": {
              "type": "string",
              "minLength": 1,
              "pattern": "^(?:hero|release|track|video|event|moment|artist)_[0-9a-f]{8}-[0-9a-f]{4}-4[0-9a-f]{3}-[89ab][0-9a-f]{3}-[0-9a-f]{12}$"
            }
          }
        },
        {
          "type": "object",
          "additionalProperties": false,
          "required": ["kind", "link"],
          "properties": {
            "kind": {
              "const": "external"
            },
            "link": {
              "$ref": "#/$defs/PlatformLink"
            }
          }
        }
      ]
    },
    "SiteConfig": {
      "type": "object",
      "additionalProperties": false,
      "required": [
        "brand",
        "artistName",
        "defaultLocale",
        "supportedLocales",
        "canonicalUrl",
        "socialLinks",
        "seo",
        "futureNavigation"
      ],
      "properties": {
        "brand": {
          "$ref": "#/$defs/LocalizedText"
        },
        "artistName": {
          "$ref": "#/$defs/LocalizedText"
        },
        "defaultLocale": {
          "const": "zh-CN"
        },
        "supportedLocales": {
          "type": "array",
          "minItems": 2,
          "uniqueItems": true,
          "items": {
            "enum": ["zh-CN", "en"]
          }
        },
        "canonicalUrl": {
          "$ref": "#/$defs/HttpsUrl"
        },
        "socialLinks": {
          "type": "array",
          "items": {
            "$ref": "#/$defs/PlatformLink"
          }
        },
        "seo": {
          "type": "object",
          "additionalProperties": false,
          "required": ["title", "description"],
          "properties": {
            "title": {
              "$ref": "#/$defs/LocalizedText"
            },
            "description": {
              "$ref": "#/$defs/LocalizedText"
            },
            "ogAssetId": {
              "type": "string",
              "pattern": "^asset_[0-9a-f]{8}-[0-9a-f]{4}-4[0-9a-f]{3}-[89ab][0-9a-f]{3}-[0-9a-f]{12}$"
            }
          }
        },
        "futureNavigation": {
          "type": "array",
          "items": {
            "type": "object",
            "additionalProperties": false,
            "required": ["id", "label", "url", "enabled"],
            "properties": {
              "id": {
                "type": "string",
                "pattern": "^nav_[0-9a-f]{8}-[0-9a-f]{4}-4[0-9a-f]{3}-[89ab][0-9a-f]{3}-[0-9a-f]{12}$"
              },
              "label": {
                "$ref": "#/$defs/LocalizedText"
              },
              "url": {
                "$ref": "#/$defs/HttpsUrl"
              },
              "enabled": {
                "type": "boolean"
              }
            }
          }
        }
      }
    },
    "Homepage": {
      "type": "object",
      "additionalProperties": false,
      "required": ["sections"],
      "properties": {
        "sections": {
          "type": "array",
          "minItems": 1,
          "items": {
            "oneOf": [
              { "$ref": "#/$defs/HeroSection" },
              { "$ref": "#/$defs/MusicSection" },
              { "$ref": "#/$defs/VideoSection" },
              { "$ref": "#/$defs/EventSection" },
              { "$ref": "#/$defs/MomentSection" },
              { "$ref": "#/$defs/ArtistSection" }
            ]
          }
        }
      }
    },
    "HeroSection": {
      "type": "object",
      "additionalProperties": false,
      "required": ["id", "type", "enabled", "layoutVariant", "itemIds"],
      "properties": {
        "id": { "type": "string", "pattern": "^section_[0-9a-f]{8}-[0-9a-f]{4}-4[0-9a-f]{3}-[89ab][0-9a-f]{3}-[0-9a-f]{12}$" },
        "type": { "const": "hero" },
        "enabled": { "type": "boolean" },
        "layoutVariant": { "const": "immersive" },
        "itemIds": {
          "type": "array",
          "maxItems": 5,
          "items": { "type": "string", "pattern": "^hero_[0-9a-f]{8}-[0-9a-f]{4}-4[0-9a-f]{3}-[89ab][0-9a-f]{3}-[0-9a-f]{12}$" }
        }
      }
    },
    "MusicSection": {
      "type": "object",
      "additionalProperties": false,
      "required": ["id", "type", "enabled", "layoutVariant", "itemIds", "limit"],
      "properties": {
        "id": { "type": "string", "pattern": "^section_[0-9a-f]{8}-[0-9a-f]{4}-4[0-9a-f]{3}-[89ab][0-9a-f]{3}-[0-9a-f]{12}$" },
        "type": { "const": "music" },
        "enabled": { "type": "boolean" },
        "layoutVariant": { "const": "cover-reel" },
        "itemIds": {
          "type": "array",
          "items": { "type": "string", "pattern": "^release_[0-9a-f]{8}-[0-9a-f]{4}-4[0-9a-f]{3}-[89ab][0-9a-f]{3}-[0-9a-f]{12}$" }
        },
        "limit": { "type": "integer", "minimum": 1, "maximum": 8 },
        "moreLink": { "$ref": "#/$defs/PlatformLink" }
      }
    },
    "VideoSection": {
      "type": "object",
      "additionalProperties": false,
      "required": ["id", "type", "enabled", "layoutVariant", "itemIds", "limit"],
      "properties": {
        "id": { "type": "string", "pattern": "^section_[0-9a-f]{8}-[0-9a-f]{4}-4[0-9a-f]{3}-[89ab][0-9a-f]{3}-[0-9a-f]{12}$" },
        "type": { "const": "video" },
        "enabled": { "type": "boolean" },
        "layoutVariant": { "const": "asymmetric" },
        "itemIds": {
          "type": "array",
          "items": { "type": "string", "pattern": "^video_[0-9a-f]{8}-[0-9a-f]{4}-4[0-9a-f]{3}-[89ab][0-9a-f]{3}-[0-9a-f]{12}$" }
        },
        "limit": { "type": "integer", "minimum": 1, "maximum": 5 }
      }
    },
    "EventSection": {
      "type": "object",
      "additionalProperties": false,
      "required": ["id", "type", "enabled", "layoutVariant", "itemIds", "limit"],
      "properties": {
        "id": { "type": "string", "pattern": "^section_[0-9a-f]{8}-[0-9a-f]{4}-4[0-9a-f]{3}-[89ab][0-9a-f]{3}-[0-9a-f]{12}$" },
        "type": { "const": "event" },
        "enabled": { "type": "boolean" },
        "layoutVariant": { "const": "timeline" },
        "itemIds": {
          "type": "array",
          "items": { "type": "string", "pattern": "^event_[0-9a-f]{8}-[0-9a-f]{4}-4[0-9a-f]{3}-[89ab][0-9a-f]{3}-[0-9a-f]{12}$" }
        },
        "limit": { "type": "integer", "minimum": 1, "maximum": 6 }
      }
    },
    "MomentSection": {
      "type": "object",
      "additionalProperties": false,
      "required": ["id", "type", "enabled", "layoutVariant", "itemIds", "limit"],
      "properties": {
        "id": { "type": "string", "pattern": "^section_[0-9a-f]{8}-[0-9a-f]{4}-4[0-9a-f]{3}-[89ab][0-9a-f]{3}-[0-9a-f]{12}$" },
        "type": { "const": "moment" },
        "enabled": { "type": "boolean" },
        "layoutVariant": { "const": "mosaic" },
        "itemIds": {
          "type": "array",
          "items": { "type": "string", "pattern": "^moment_[0-9a-f]{8}-[0-9a-f]{4}-4[0-9a-f]{3}-[89ab][0-9a-f]{3}-[0-9a-f]{12}$" }
        },
        "limit": { "type": "integer", "minimum": 1, "maximum": 8 }
      }
    },
    "ArtistSection": {
      "type": "object",
      "additionalProperties": false,
      "required": ["id", "type", "enabled", "layoutVariant", "itemIds"],
      "properties": {
        "id": { "type": "string", "pattern": "^section_[0-9a-f]{8}-[0-9a-f]{4}-4[0-9a-f]{3}-[89ab][0-9a-f]{3}-[0-9a-f]{12}$" },
        "type": { "const": "artist" },
        "enabled": { "type": "boolean" },
        "layoutVariant": { "const": "split" },
        "itemIds": {
          "type": "array",
          "maxItems": 1,
          "items": { "type": "string", "pattern": "^artist_[0-9a-f]{8}-[0-9a-f]{4}-4[0-9a-f]{3}-[89ab][0-9a-f]{3}-[0-9a-f]{12}$" }
        }
      }
    },
    "HeroSlide": {
      "type": "object",
      "additionalProperties": false,
      "required": ["id", "mediaKind", "assetId", "focalPoint", "headline", "autoplay"],
      "properties": {
        "id": { "type": "string", "pattern": "^hero_[0-9a-f]{8}-[0-9a-f]{4}-4[0-9a-f]{3}-[89ab][0-9a-f]{3}-[0-9a-f]{12}$" },
        "mediaKind": { "enum": ["image", "gif", "video"] },
        "assetId": { "type": "string", "pattern": "^asset_[0-9a-f]{8}-[0-9a-f]{4}-4[0-9a-f]{3}-[89ab][0-9a-f]{3}-[0-9a-f]{12}$" },
        "mobileAssetId": { "type": "string", "pattern": "^asset_[0-9a-f]{8}-[0-9a-f]{4}-4[0-9a-f]{3}-[89ab][0-9a-f]{3}-[0-9a-f]{12}$" },
        "posterAssetId": { "type": "string", "pattern": "^asset_[0-9a-f]{8}-[0-9a-f]{4}-4[0-9a-f]{3}-[89ab][0-9a-f]{3}-[0-9a-f]{12}$" },
        "focalPoint": {
          "type": "object",
          "additionalProperties": false,
          "required": ["x", "y"],
          "properties": {
            "x": { "type": "number", "minimum": 0, "maximum": 100 },
            "y": { "type": "number", "minimum": 0, "maximum": 100 }
          }
        },
        "headline": { "$ref": "#/$defs/LocalizedText" },
        "releaseId": { "type": "string", "pattern": "^release_[0-9a-f]{8}-[0-9a-f]{4}-4[0-9a-f]{3}-[89ab][0-9a-f]{3}-[0-9a-f]{12}$" },
        "target": { "$ref": "#/$defs/ContentTarget" },
        "autoplay": { "type": "boolean" },
        "startsAt": { "type": "string", "format": "date-time" },
        "endsAt": { "type": "string", "format": "date-time" }
      }
    },
    "Release": {
      "type": "object",
      "additionalProperties": false,
      "required": ["id", "kind", "title", "coverAssetId", "releaseDate", "trackIds", "platformLinks", "featured"],
      "properties": {
        "id": { "type": "string", "pattern": "^release_[0-9a-f]{8}-[0-9a-f]{4}-4[0-9a-f]{3}-[89ab][0-9a-f]{3}-[0-9a-f]{12}$" },
        "kind": { "enum": ["single", "ep", "album"] },
        "title": { "$ref": "#/$defs/LocalizedText" },
        "coverAssetId": { "type": "string", "pattern": "^asset_[0-9a-f]{8}-[0-9a-f]{4}-4[0-9a-f]{3}-[89ab][0-9a-f]{3}-[0-9a-f]{12}$" },
        "releaseDate": { "type": "string", "format": "date" },
        "trackIds": {
          "type": "array",
          "minItems": 1,
          "items": { "type": "string", "pattern": "^track_[0-9a-f]{8}-[0-9a-f]{4}-4[0-9a-f]{3}-[89ab][0-9a-f]{3}-[0-9a-f]{12}$" }
        },
        "platformLinks": {
          "type": "array",
          "items": { "$ref": "#/$defs/PlatformLink" }
        },
        "featured": { "type": "boolean" }
      }
    },
    "Track": {
      "type": "object",
      "additionalProperties": false,
      "required": ["id", "releaseId", "title", "durationSeconds", "platformLinks", "credits"],
      "properties": {
        "id": { "type": "string", "pattern": "^track_[0-9a-f]{8}-[0-9a-f]{4}-4[0-9a-f]{3}-[89ab][0-9a-f]{3}-[0-9a-f]{12}$" },
        "releaseId": { "type": "string", "pattern": "^release_[0-9a-f]{8}-[0-9a-f]{4}-4[0-9a-f]{3}-[89ab][0-9a-f]{3}-[0-9a-f]{12}$" },
        "title": { "$ref": "#/$defs/LocalizedText" },
        "durationSeconds": { "type": "integer", "minimum": 1 },
        "previewAssetId": { "type": "string", "pattern": "^asset_[0-9a-f]{8}-[0-9a-f]{4}-4[0-9a-f]{3}-[89ab][0-9a-f]{3}-[0-9a-f]{12}$" },
        "previewDurationSeconds": { "type": "integer", "minimum": 1, "maximum": 90 },
        "platformLinks": {
          "type": "array",
          "items": { "$ref": "#/$defs/PlatformLink" }
        },
        "credits": {
          "type": "array",
          "items": {
            "type": "object",
            "additionalProperties": false,
            "required": ["role", "name"],
            "properties": {
              "role": { "$ref": "#/$defs/LocalizedText" },
              "name": { "type": "string", "minLength": 1 }
            }
          }
        }
      }
    },
    "Video": {
      "type": "object",
      "additionalProperties": false,
      "required": ["id", "title", "posterAssetId", "durationSeconds", "platformLinks", "featured"],
      "properties": {
        "id": { "type": "string", "pattern": "^video_[0-9a-f]{8}-[0-9a-f]{4}-4[0-9a-f]{3}-[89ab][0-9a-f]{3}-[0-9a-f]{12}$" },
        "title": { "$ref": "#/$defs/LocalizedText" },
        "posterAssetId": { "type": "string", "pattern": "^asset_[0-9a-f]{8}-[0-9a-f]{4}-4[0-9a-f]{3}-[89ab][0-9a-f]{3}-[0-9a-f]{12}$" },
        "videoAssetId": { "type": "string", "pattern": "^asset_[0-9a-f]{8}-[0-9a-f]{4}-4[0-9a-f]{3}-[89ab][0-9a-f]{3}-[0-9a-f]{12}$" },
        "durationSeconds": { "type": "integer", "minimum": 1 },
        "platformLinks": {
          "type": "array",
          "minItems": 1,
          "items": { "$ref": "#/$defs/PlatformLink" }
        },
        "featured": { "type": "boolean" }
      }
    },
    "Event": {
      "type": "object",
      "additionalProperties": false,
      "required": ["id", "title", "dateTime", "city", "venue", "status", "detailUrl"],
      "properties": {
        "id": { "type": "string", "pattern": "^event_[0-9a-f]{8}-[0-9a-f]{4}-4[0-9a-f]{3}-[89ab][0-9a-f]{3}-[0-9a-f]{12}$" },
        "title": { "$ref": "#/$defs/LocalizedText" },
        "dateTime": { "type": "string", "format": "date-time" },
        "city": { "$ref": "#/$defs/LocalizedText" },
        "venue": { "$ref": "#/$defs/LocalizedText" },
        "status": { "enum": ["scheduled", "sold-out", "cancelled"] },
        "detailUrl": { "$ref": "#/$defs/HttpsUrl" },
        "posterAssetId": { "type": "string", "pattern": "^asset_[0-9a-f]{8}-[0-9a-f]{4}-4[0-9a-f]{3}-[89ab][0-9a-f]{3}-[0-9a-f]{12}$" }
      }
    },
    "Moment": {
      "type": "object",
      "additionalProperties": false,
      "required": ["id", "assetId"],
      "properties": {
        "id": { "type": "string", "pattern": "^moment_[0-9a-f]{8}-[0-9a-f]{4}-4[0-9a-f]{3}-[89ab][0-9a-f]{3}-[0-9a-f]{12}$" },
        "assetId": { "type": "string", "pattern": "^asset_[0-9a-f]{8}-[0-9a-f]{4}-4[0-9a-f]{3}-[89ab][0-9a-f]{3}-[0-9a-f]{12}$" },
        "caption": { "$ref": "#/$defs/LocalizedText" },
        "target": { "$ref": "#/$defs/ContentTarget" }
      }
    },
    "ArtistProfile": {
      "type": "object",
      "additionalProperties": false,
      "required": ["id", "name", "shortBio", "platformLinks"],
      "properties": {
        "id": { "type": "string", "pattern": "^artist_[0-9a-f]{8}-[0-9a-f]{4}-4[0-9a-f]{3}-[89ab][0-9a-f]{3}-[0-9a-f]{12}$" },
        "name": { "$ref": "#/$defs/LocalizedText" },
        "shortBio": { "$ref": "#/$defs/LocalizedText" },
        "portraitAssetId": { "type": "string", "pattern": "^asset_[0-9a-f]{8}-[0-9a-f]{4}-4[0-9a-f]{3}-[89ab][0-9a-f]{3}-[0-9a-f]{12}$" },
        "platformLinks": {
          "type": "array",
          "items": { "$ref": "#/$defs/PlatformLink" }
        }
      }
    },
    "Asset": {
      "type": "object",
      "additionalProperties": false,
      "required": ["id", "kind", "src", "mimeType", "byteSize", "alt", "rights", "checksum"],
      "oneOf": [
        {
          "required": ["kind", "mimeType"],
          "properties": {
            "kind": { "const": "image" },
            "mimeType": { "const": "image/webp" }
          }
        },
        {
          "required": ["kind", "mimeType"],
          "properties": {
            "kind": { "const": "gif" },
            "mimeType": { "const": "image/gif" }
          }
        },
        {
          "required": ["kind", "mimeType"],
          "properties": {
            "kind": { "const": "video" },
            "mimeType": { "const": "video/mp4" }
          }
        },
        {
          "required": ["kind", "mimeType"],
          "properties": {
            "kind": { "const": "audio" },
            "mimeType": { "enum": ["audio/wav", "audio/mpeg"] }
          }
        }
      ],
      "properties": {
        "id": { "type": "string", "pattern": "^asset_[0-9a-f]{8}-[0-9a-f]{4}-4[0-9a-f]{3}-[89ab][0-9a-f]{3}-[0-9a-f]{12}$" },
        "kind": { "enum": ["image", "gif", "video", "audio"] },
        "src": { "$ref": "#/$defs/MediaUrl" },
        "mimeType": {
          "enum": ["image/webp", "image/gif", "video/mp4", "audio/wav", "audio/mpeg"]
        },
        "byteSize": { "type": "integer", "minimum": 1 },
        "width": { "type": "integer", "minimum": 1 },
        "height": { "type": "integer", "minimum": 1 },
        "durationSeconds": { "type": "number", "exclusiveMinimum": 0 },
        "posterAssetId": { "type": "string", "pattern": "^asset_[0-9a-f]{8}-[0-9a-f]{4}-4[0-9a-f]{3}-[89ab][0-9a-f]{3}-[0-9a-f]{12}$" },
        "alt": { "$ref": "#/$defs/LocalizedText" },
        "rights": {
          "type": "object",
          "additionalProperties": false,
          "required": ["source"],
          "properties": {
            "source": { "$ref": "#/$defs/LocalizedText" },
            "credit": { "type": "string" },
            "license": { "type": "string" }
          }
        },
        "checksum": {
          "type": "string",
          "pattern": "^sha256:[a-f0-9]{64}$"
        }
      }
    }
  }
}
