{
  "schemaVersion": "1.0.0",
  "releaseId": "rel_14c9e5f2-718a-4271-b3e1-643f1a1d6ccc",
  "generatedAt": "2026-08-29T00:00:00Z",
  "site": {
    "brand": {
      "zh-CN": "遇健我",
      "en": "Meet Jian"
    },
    "artistName": {
      "zh-CN": "王子健",
      "en": "Wang Zijian"
    },
    "defaultLocale": "zh-CN",
    "supportedLocales": [
      "zh-CN",
      "en"
    ],
    "canonicalUrl": "https://yujian.me",
    "socialLinks": [
      {
        "provider": "netease-music",
        "url": "https://music.163.com/#/artist?id=12382128"
      },
      {
        "provider": "qq-music",
        "url": "https://y.qq.com/n/ryqq_v2/singer/0036zydh4H05PB"
      },
      {
        "provider": "weibo",
        "url": "https://weibo.com/u/5693099362"
      },
      {
        "provider": "bilibili",
        "url": "https://space.bilibili.com/21096618"
      },
      {
        "provider": "douyin",
        "url": "https://www.douyin.com/user/MS4wLjABAAAABfp-B2z7duVeezC81eAOicdyJ9pn_ANxkbCWVT__uR0"
      }
    ],
    "seo": {
      "title": {
        "zh-CN": "遇健我 · 王子健",
        "en": "Meet Jian · Wang Zijian"
      },
      "description": {
        "zh-CN": "音乐人王子健官方站",
        "en": "The official website of musician Wang Zijian"
      },
      "ogAssetId": "asset_e020cc5b-3c4e-4779-803e-8ccd74d7c0ad"
    },
    "futureNavigation": []
  },
  "homepage": {
    "sections": [
      {
        "id": "section_b94a248c-1c93-4f9a-98df-059f4fde1cf5",
        "type": "hero",
        "enabled": true,
        "layoutVariant": "immersive",
        "itemIds": [
          "hero_7cfbd2b5-69b4-41f6-9dbd-275c587b70cb",
          "hero_cec07764-0923-4dcc-a57b-a8630ce91f51",
          "hero_758af7a3-cc08-47c4-a49a-9e1f22abdb3c"
        ]
      },
      {
        "id": "section_1941aa2b-341c-471c-9408-760fbd9edcea",
        "type": "music",
        "enabled": true,
        "layoutVariant": "cover-reel",
        "itemIds": [
          "release_5081a10a-7f9a-4af5-a7dc-2b522e1d3cff",
          "release_f9462a63-70d9-40b3-a0cc-a792f1b5499e",
          "release_1cf30b59-7996-4c85-a020-5dedf63339d0",
          "release_86a979f0-3bdd-4e74-83de-9d2db77de6fa",
          "release_3033d928-4d31-4601-bb92-ffa2d9e8d54b"
        ],
        "limit": 5,
        "moreLink": {
          "provider": "qq-music",
          "url": "https://y.qq.com/n/ryqq_v2/singer/0036zydh4H05PB"
        }
      },
      {
        "id": "section_3acb34b6-b57b-4991-bc64-df9690915edc",
        "type": "video",
        "enabled": true,
        "layoutVariant": "asymmetric",
        "itemIds": [
          "video_b634e94d-b468-4e4b-b784-22eda2c49314",
          "video_93d8a998-c34b-4aca-80f0-02cb233a4481",
          "video_8ba6c435-f5b3-4603-a43e-f326ba0a12a5"
        ],
        "limit": 3
      },
      {
        "id": "section_6f69e09d-c025-4920-98dd-f96daa2df153",
        "type": "event",
        "enabled": true,
        "layoutVariant": "timeline",
        "itemIds": [
          "event_dc200c4c-abbb-476e-984d-405470f2dbea",
          "event_b9413813-c666-4987-bb0c-2850fd7fa156"
        ],
        "limit": 2
      },
      {
        "id": "section_4dc347e2-db34-4763-ab76-7611cd235905",
        "type": "moment",
        "enabled": true,
        "layoutVariant": "mosaic",
        "itemIds": [
          "moment_c8f0a2c9-7b1f-4bcc-a6c0-e6d5e74538c8",
          "moment_62c26d1a-0b36-4184-a1d2-c3b92869bd60",
          "moment_04c78ef0-8069-4b6a-8f23-ffb70d06490e"
        ],
        "limit": 3
      },
      {
        "id": "section_5258d853-1b97-41b2-b1a8-b67e6163743b",
        "type": "artist",
        "enabled": true,
        "layoutVariant": "split",
        "itemIds": [
          "artist_eb908750-faf8-418f-94c6-97f769c1cf31"
        ]
      }
    ]
  },
  "heroSlides": [
    {
      "id": "hero_7cfbd2b5-69b4-41f6-9dbd-275c587b70cb",
      "mediaKind": "image",
      "assetId": "asset_e020cc5b-3c4e-4779-803e-8ccd74d7c0ad",
      "focalPoint": {
        "x": 50,
        "y": 45
      },
      "headline": {
        "zh-CN": "遇健我",
        "en": "Meet Jian"
      },
      "autoplay": false
    },
    {
      "id": "hero_cec07764-0923-4dcc-a57b-a8630ce91f51",
      "mediaKind": "image",
      "assetId": "asset_24dbb73c-be93-4839-813b-f81fd5806009",
      "focalPoint": {
        "x": 62,
        "y": 40
      },
      "headline": {
        "zh-CN": "示例现场",
        "en": "Sample Live Session"
      },
      "target": {
        "kind": "external",
        "link": {
          "provider": "bilibili",
          "url": "https://space.bilibili.com/21096618"
        }
      },
      "autoplay": false
    },
    {
      "id": "hero_758af7a3-cc08-47c4-a49a-9e1f22abdb3c",
      "mediaKind": "image",
      "assetId": "asset_24dbb73c-be93-4839-813b-f81fd5806009",
      "focalPoint": {
        "x": 35,
        "y": 55
      },
      "headline": {
        "zh-CN": "示例作品 01",
        "en": "Sample Release 01"
      },
      "releaseId": "release_5081a10a-7f9a-4af5-a7dc-2b522e1d3cff",
      "target": {
        "kind": "internal",
        "contentId": "release_5081a10a-7f9a-4af5-a7dc-2b522e1d3cff"
      },
      "autoplay": false
    }
  ],
  "releases": [
    {
      "id": "release_5081a10a-7f9a-4af5-a7dc-2b522e1d3cff",
      "kind": "single",
      "title": {
        "zh-CN": "示例作品 01",
        "en": "Sample Release 01"
      },
      "coverAssetId": "asset_2f183eda-5f01-4c34-93f6-47739c136bb2",
      "releaseDate": "2026-08-01",
      "trackIds": [
        "track_e60c46c7-28d6-418e-8905-167307dc8354"
      ],
      "platformLinks": [
        {
          "provider": "qq-music",
          "url": "https://y.qq.com/n/ryqq_v2/singer/0036zydh4H05PB"
        },
        {
          "provider": "netease-music",
          "url": "https://music.163.com/#/artist?id=12382128"
        }
      ],
      "featured": true
    },
    {
      "id": "release_f9462a63-70d9-40b3-a0cc-a792f1b5499e",
      "kind": "single",
      "title": {
        "zh-CN": "示例作品 02",
        "en": "Sample Release 02"
      },
      "coverAssetId": "asset_5f8b24c3-04fa-405e-9f16-5c9a434d620e",
      "releaseDate": "2026-07-01",
      "trackIds": [
        "track_ceb1e68b-da25-4104-803e-3af3708b8593"
      ],
      "platformLinks": [
        {
          "provider": "qq-music",
          "url": "https://y.qq.com/n/ryqq_v2/singer/0036zydh4H05PB"
        },
        {
          "provider": "netease-music",
          "url": "https://music.163.com/#/artist?id=12382128"
        }
      ],
      "featured": true
    },
    {
      "id": "release_1cf30b59-7996-4c85-a020-5dedf63339d0",
      "kind": "ep",
      "title": {
        "zh-CN": "示例作品 03",
        "en": "Sample Release 03"
      },
      "coverAssetId": "asset_279f5368-5e29-4df6-87db-9cd52db57890",
      "releaseDate": "2026-06-01",
      "trackIds": [
        "track_f7a7ecdc-b37d-428f-ad99-c04243425bf4"
      ],
      "platformLinks": [
        {
          "provider": "qq-music",
          "url": "https://y.qq.com/n/ryqq_v2/singer/0036zydh4H05PB"
        },
        {
          "provider": "netease-music",
          "url": "https://music.163.com/#/artist?id=12382128"
        }
      ],
      "featured": false
    },
    {
      "id": "release_86a979f0-3bdd-4e74-83de-9d2db77de6fa",
      "kind": "single",
      "title": {
        "zh-CN": "示例作品 04",
        "en": "Sample Release 04"
      },
      "coverAssetId": "asset_9ba4683d-dec4-4c0a-a1fa-8319694f67ff",
      "releaseDate": "2026-05-01",
      "trackIds": [
        "track_ea036706-61e9-484c-87b7-ce2310e4c604"
      ],
      "platformLinks": [
        {
          "provider": "qq-music",
          "url": "https://y.qq.com/n/ryqq_v2/singer/0036zydh4H05PB"
        },
        {
          "provider": "netease-music",
          "url": "https://music.163.com/#/artist?id=12382128"
        }
      ],
      "featured": false
    },
    {
      "id": "release_3033d928-4d31-4601-bb92-ffa2d9e8d54b",
      "kind": "album",
      "title": {
        "zh-CN": "示例作品 05",
        "en": "Sample Release 05"
      },
      "coverAssetId": "asset_86ebdb53-875e-4192-9970-468bc34b1d83",
      "releaseDate": "2026-04-01",
      "trackIds": [
        "track_1765c647-056c-47ac-b130-b738ed8744e1"
      ],
      "platformLinks": [
        {
          "provider": "qq-music",
          "url": "https://y.qq.com/n/ryqq_v2/singer/0036zydh4H05PB"
        },
        {
          "provider": "netease-music",
          "url": "https://music.163.com/#/artist?id=12382128"
        }
      ],
      "featured": false
    }
  ],
  "tracks": [
    {
      "id": "track_e60c46c7-28d6-418e-8905-167307dc8354",
      "releaseId": "release_5081a10a-7f9a-4af5-a7dc-2b522e1d3cff",
      "title": {
        "zh-CN": "示例曲目 01",
        "en": "Sample Track 01"
      },
      "durationSeconds": 180,
      "previewAssetId": "asset_71734f61-5250-4825-a8b3-0192448be437",
      "previewDurationSeconds": 3,
      "platformLinks": [
        {
          "provider": "qq-music",
          "url": "https://y.qq.com/n/ryqq_v2/singer/0036zydh4H05PB"
        },
        {
          "provider": "netease-music",
          "url": "https://music.163.com/#/artist?id=12382128"
        }
      ],
      "credits": [
        {
          "role": {
            "zh-CN": "音乐人",
            "en": "Musician"
          },
          "name": "王子健"
        }
      ]
    },
    {
      "id": "track_ceb1e68b-da25-4104-803e-3af3708b8593",
      "releaseId": "release_f9462a63-70d9-40b3-a0cc-a792f1b5499e",
      "title": {
        "zh-CN": "示例曲目 02",
        "en": "Sample Track 02"
      },
      "durationSeconds": 205,
      "platformLinks": [
        {
          "provider": "qq-music",
          "url": "https://y.qq.com/n/ryqq_v2/singer/0036zydh4H05PB"
        },
        {
          "provider": "netease-music",
          "url": "https://music.163.com/#/artist?id=12382128"
        }
      ],
      "credits": [
        {
          "role": {
            "zh-CN": "音乐人",
            "en": "Musician"
          },
          "name": "王子健"